{
  "schema_version": "1.0.0",
  "record_type": "evidence_review",
  "id": "senolytics-coverage-repair-taxonomy-mapping-2026-06-21",
  "candidate_change_id": "senolytics-coverage-repair-2026-06-21",
  "review_lane": "taxonomy_mapping",
  "reviewer_kind": "agent",
  "reviewer_id": "codex",
  "status": "draft",
  "verdict": "needs_human_judgment",
  "blocking": false,
  "summary": "Placeholder review lane added during generation-system hardening. The senolytics track and cellular-senescence mapping are plausible, but the full set of cross-hallmark mappings has not been independently reviewed.",
  "findings": [
    {
      "finding_id": "taxonomy-lane-not-complete",
      "severity": "major",
      "category": "taxonomy_mapping",
      "claim_or_issue": "Coverage-repair records include cellular senescence, chronic inflammation, and related endpoint mappings that have not all had independent taxonomy review.",
      "why_it_matters": "Track and hallmark mappings drive downstream evidence maps and filters; weak mappings can make consumers overinterpret heterogeneous records as one synthesis group.",
      "recommended_action": "Review each finding, outcome, and result against the senolytics track definition and hallmark taxonomy before promotion.",
      "resolution_status": "open"
    }
  ]
}
